{"contract":{"name":"action_intent","version":"v1"},"intent_id":"intent_diff_001","issued_at":"2026-01-01T12:00:00Z","expires_at":"2026-01-01T12:05:00Z","tenant":{"tenant_id":"tenant_acme"},"requester":{"type":"agent","id":"agent_7"},"action":{"name":"payment.refund","capability":"payments.refund","parameters":{"amount_minor":9223372036854775808,"currency":"EUR","memo":"Rückerstattung für Bestellung #42 ✓"}},"target":{"resource_type":"charge","resource_id":"ch_3Nq"}}