{"target":{"resource_type":"charge","resource_id":"ch_3Nq"},"action":{"name":"payment.refund","capability":"payments.refund","parameters":{"amount_minor":2500,"currency":"EUR","memo":"Rückerstattung für Bestellung #42 ✓"}},"requester":{"type":"agent","id":"agent_7"},"tenant":{"tenant_id":"tenant_acme"},"expires_at":"2026-01-01T12:05:00Z","issued_at":"2026-01-01T12:00:00Z","intent_id":"intent_diff_001","contract":{"name":"action_intent","version":"v1"}}