{
  "action": {
    "capability": "finance.transfer.release",
    "constraints": {
      "contract_version_ref": "open_execution_kernel.action_intent.finance.v1alpha1",
      "workflow_key": "payments.standard"
    },
    "name": "invoice_payment.transfer",
    "parameters": {
      "action_type": "transfer",
      "amount_minor": 810000,
      "currency": "USD",
      "destination_account_ref": "acct-destination-cloud-v1",
      "destination_country": "GB",
      "source_account_ref": "acct-source-cloud-v1",
      "workflow_key": "payments.standard"
    }
  },
  "context": {
    "cloud_action_intent_record_id": "air_cloud_invoice_v1",
    "cloud_submission_id": "submission_cloud_invoice_v1",
    "finance_index": {
      "action_type": "transfer",
      "amount_minor": 800000,
      "currency": "USD",
      "destination_account_ref": "acct-destination-cloud-v1",
      "destination_country": "GB",
      "risk_tier": "high",
      "source_account_ref": "acct-source-cloud-v1",
      "workflow_key": "payments.standard"
    },
    "kernel_action_intent": {
      "action_type": "transfer",
      "amount_minor": 800000,
      "currency": "USD",
      "destination_account_ref": "acct-destination-cloud-v1",
      "destination_country": "GB",
      "evidence_refs": [
        "evidence_invoice_cloud_v1"
      ],
      "intent_id": "intent_cloud_invoice_v1",
      "source_account_ref": "acct-source-cloud-v1",
      "workflow_key": "payments.standard"
    }
  },
  "contract": {
    "name": "action_intent",
    "version": "v1"
  },
  "expires_at": "2026-01-15T12:15:00Z",
  "idempotency_key": "idem_cloud_invoice_v1",
  "intent_id": "intent_cloud_invoice_v1",
  "issued_at": "2026-01-15T12:00:00Z",
  "metadata": {
    "cloud_action_intent_record_id": "air_cloud_invoice_v1",
    "contract_version_ref": "open_execution_kernel.action_intent.finance.v1alpha1",
    "policy_id": "policy_cloud_invoice_v1",
    "policy_version": "1"
  },
  "requester": {
    "id": "requester_cloud_invoice_v1",
    "type": "user"
  },
  "target": {
    "resource_id": "acct-destination-cloud-v1",
    "resource_type": "finance_destination_account",
    "selectors": {
      "destination_country": "GB"
    }
  },
  "tenant": {
    "tenant_id": "tenant_cloud_invoice_v1"
  }
}
