{
  "action": {
    "capability": "database.migration.execute",
    "constraints": {
      "exact_change_set_sha256": "mig_2026_01_add_projects_index",
      "exact_environment": "production",
      "exact_migration_id": "2026_01_add_projects_index"
    },
    "name": "database.schema.apply",
    "parameters": {
      "change_set_sha256": "mig_2026_01_add_projects_index",
      "environment": "production",
      "migration_id": "2026_01_add_projects_index"
    },
    "scope": {
      "single_use": true,
      "target_resource_type": "database"
    }
  },
  "context": {
    "mode": "incident-simulator"
  },
  "contract": {
    "name": "action_intent",
    "version": "v1"
  },
  "expires_at": "2026-01-01T12:05:00Z",
  "intent_id": "intent_incident_replit_001",
  "issued_at": "2026-01-01T12:00:00Z",
  "justification": "Apply a single reviewed schema migration to the production customer database.",
  "metadata": {
    "simulation": "incident"
  },
  "requester": {
    "id": "simulator_agent",
    "type": "service"
  },
  "target": {
    "resource_id": "customer_prod_primary",
    "resource_type": "database"
  },
  "tenant": {
    "tenant_id": "tenant_demo"
  }
}
